<?xml version="1.0"?>
<!DOCTYPE VOTABLE SYSTEM "http://us-vo.org/xml/VOTable.dtd">
<VOTABLE version="v1.0">
<DEFINITIONS>
<COOSYS ID="J2000" equinox="2000." epoch="2000." system="eq_FK5" />
</DEFINITIONS>
<RESOURCE>
<PARAM name="fixlen" datatype="char" arraysize="*" value="T" />
<PARAM name="primary" datatype="char" arraysize="*" value="0" />
<PARAM name="RowsRetrieved" datatype="char" arraysize="*" value="18" />
<PARAM name="QueryTime" datatype="char" arraysize="*" value="00:00:00.01625" />
<PARAM name="ORIGIN" datatype="char" arraysize="*" value="&apos;IPAC Infrared Science Archive (IRSA), Caltech/JPL&apos;" />
<PARAM name="DATETIME" datatype="char" arraysize="*" value="&apos;2010-06-16 17:10:01&apos;" />
<PARAM name="DataTag" datatype="char" arraysize="*" value="&apos;ADS/IRSA.Gator#2010/0616/171001_27166&apos;" />
<PARAM name="DATABASE" datatype="char" arraysize="*" value="&apos;2MASS All-Sky Point Source Catalog (PSC) (fp_psc)&apos;" />
<PARAM name="EQUINOX" datatype="char" arraysize="*" value="&apos;J2000&apos;" />
<PARAM name="SKYAREA" datatype="char" arraysize="*" value="&apos;within 10 arcsec of  ra=10.68468 dec=+41.26904 Eq J2000 &apos;" />
<PARAM name="SQL" datatype="char" arraysize="*" value="&apos;WHERE (no constraints)" />
<PARAM name="SQL" datatype="char" arraysize="*" value="&apos;SELECT (19 column names follow in next row.)&apos;" />
<TABLE>
<FIELD name="ra" ucd="POS_EQ_RA_MAIN" ref="J2000" datatype="float" unit="deg" precision="F3" width="7" />
<FIELD name="dec" ucd="POS_EQ_DEC_MAIN" ref="J2000" datatype="float" unit="deg" precision="F3" width="7" />
<FIELD name="clon" datatype="char" arraysize="*"/>
<FIELD name="clat" datatype="char" arraysize="*"/>
<FIELD name="err_maj" datatype="double" unit="arcsec"/>
<FIELD name="err_min" datatype="double" unit="arcsec"/>
<FIELD name="designation" datatype="char" arraysize="*"/>
<FIELD name="j_m" datatype="double" unit="mag"/>
<FIELD name="j_msigcom" datatype="double" unit="mag"/>
<FIELD name="h_m" datatype="double" unit="mag"/>
<FIELD name="h_msigcom" datatype="double" unit="mag"/>
<FIELD name="k_m" datatype="double" unit="mag"/>
<FIELD name="k_msigcom" datatype="double" unit="mag"/>
<FIELD name="ph_qual" datatype="char" arraysize="*"/>
<FIELD name="rd_flg" datatype="char" arraysize="*"/>
<FIELD name="bl_flg" datatype="char" arraysize="*"/>
<FIELD name="cc_flg" datatype="char" arraysize="*"/>
<FIELD name="gal_contam" datatype="int" unit=" "/>
<FIELD name="mp_flg" datatype="int" unit=" "/>
<FIELD name="dist" datatype="double" unit=" "/>
<FIELD name="angle" datatype="double" unit=" "/>
<FIELD name="j_h" datatype="double" unit=" "/>
<FIELD name="h_k" datatype="double" unit=" "/>
<FIELD name="j_k" datatype="double" unit=" "/>
<FIELD name="id" ucd="ID_MAIN" datatype="char" arraysize="*" />
<DATA>
<TABLEDATA>
<TR><TD>10.683263</TD><TD>41.267456</TD><TD>00h42m43.98s</TD><TD>41d16m02.84s</TD><TD>0.13</TD><TD>0.12</TD><TD>00424398+4116028</TD><TD>12.136</TD><TD>0.040</TD><TD>9.226</TD><TD>null</TD><TD>8.994</TD><TD>null</TD><TD>AUU</TD><TD>200</TD><TD>100</TD><TD>c00</TD><TD>2</TD><TD>0</TD><TD>6.871574</TD><TD>213.916</TD><TD>-</TD><TD>-</TD><TD>-</TD><TD>0</TD></TR>
<TR><TD>10.682777</TD><TD>41.270111</TD><TD>00h42m43.87s</TD><TD>41d16m12.40s</TD><TD>0.10</TD><TD>0.09</TD><TD>00424386+4116123</TD><TD>9.977</TD><TD>null</TD><TD>11.683</TD><TD>0.056</TD><TD>11.839</TD><TD>0.062</TD><TD>UAA</TD><TD>022</TD><TD>011</TD><TD>0cc</TD><TD>2</TD><TD>0</TD><TD>6.432619</TD><TD>306.825</TD><TD>-</TD><TD>-0.1560</TD><TD>-</TD><TD>1</TD></TR>
<TR><TD>10.684737</TD><TD>41.269035</TD><TD>00h42m44.34s</TD><TD>41d16m08.53s</TD><TD>0.08</TD><TD>0.07</TD><TD>00424433+4116085</TD><TD>9.453</TD><TD>0.052</TD><TD>8.668</TD><TD>0.051</TD><TD>8.475</TD><TD>0.051</TD><TD>EEE</TD><TD>222</TD><TD>111</TD><TD>000</TD><TD>2</TD><TD>0</TD><TD>0.155330</TD><TD>96.656</TD><TD>0.7850</TD><TD>0.1930</TD><TD>0.9780</TD><TD>2</TD></TR>
<TR><TD>10.682383</TD><TD>41.267925</TD><TD>00h42m43.77s</TD><TD>41d16m04.53s</TD><TD>0.10</TD><TD>0.09</TD><TD>00424377+4116045</TD><TD>12.446</TD><TD>0.061</TD><TD>11.753</TD><TD>0.063</TD><TD>9.075</TD><TD>null</TD><TD>AAU</TD><TD>220</TD><TD>110</TD><TD>cc0</TD><TD>2</TD><TD>0</TD><TD>7.398810</TD><TD>237.145</TD><TD>0.6930</TD><TD>-</TD><TD>-</TD><TD>3</TD></TR>
<TR><TD>10.686026</TD><TD>41.269226</TD><TD>00h42m44.65s</TD><TD>41d16m09.21s</TD><TD>0.13</TD><TD>0.12</TD><TD>00424464+4116092</TD><TD>9.299</TD><TD>null</TD><TD>8.606</TD><TD>null</TD><TD>10.119</TD><TD>0.056</TD><TD>UUE</TD><TD>002</TD><TD>001</TD><TD>00c</TD><TD>2</TD><TD>0</TD><TD>3.703143</TD><TD>79.581</TD><TD>-</TD><TD>-</TD><TD>-</TD><TD>4</TD></TR>
<TR><TD>10.685657</TD><TD>41.269550</TD><TD>00h42m44.56s</TD><TD>41d16m10.38s</TD><TD>0.13</TD><TD>0.12</TD><TD>00424455+4116103</TD><TD>10.773</TD><TD>0.069</TD><TD>8.532</TD><TD>null</TD><TD>8.254</TD><TD>null</TD><TD>EUU</TD><TD>200</TD><TD>200</TD><TD>c00</TD><TD>2</TD><TD>0</TD><TD>3.218640</TD><TD>55.219</TD><TD>-</TD><TD>-</TD><TD>-</TD><TD>5</TD></TR>
<TR><TD>10.684029</TD><TD>41.270901</TD><TD>00h42m44.17s</TD><TD>41d16m15.24s</TD><TD>0.13</TD><TD>0.12</TD><TD>00424416+4116152</TD><TD>10.063</TD><TD>null</TD><TD>9.359</TD><TD>null</TD><TD>11.409</TD><TD>0.055</TD><TD>UUA</TD><TD>002</TD><TD>001</TD><TD>00c</TD><TD>2</TD><TD>0</TD><TD>6.927244</TD><TD>345.269</TD><TD>-</TD><TD>-</TD><TD>-</TD><TD>6</TD></TR>
<TR><TD>10.687611</TD><TD>41.270302</TD><TD>00h42m45.03s</TD><TD>41d16m13.09s</TD><TD>0.18</TD><TD>0.14</TD><TD>00424502+4116130</TD><TD>13.055</TD><TD>0.109</TD><TD>9.504</TD><TD>null</TD><TD>9.246</TD><TD>null</TD><TD>AUU</TD><TD>200</TD><TD>200</TD><TD>c00</TD><TD>2</TD><TD>0</TD><TD>9.139894</TD><TD>60.192</TD><TD>-</TD><TD>-</TD><TD>-</TD><TD>7</TD></TR>
<TR><TD>10.687414</TD><TD>41.267632</TD><TD>00h42m44.98s</TD><TD>41d16m03.48s</TD><TD>0.13</TD><TD>0.12</TD><TD>00424497+4116034</TD><TD>12.371</TD><TD>0.036</TD><TD>9.627</TD><TD>null</TD><TD>9.379</TD><TD>null</TD><TD>EUU</TD><TD>200</TD><TD>100</TD><TD>c00</TD><TD>2</TD><TD>0</TD><TD>8.967827</TD><TD>124.417</TD><TD>-</TD><TD>-</TD><TD>-</TD><TD>8</TD></TR>
<TR><TD>10.684180</TD><TD>41.266941</TD><TD>00h42m44.20s</TD><TD>41d16m00.99s</TD><TD>0.13</TD><TD>0.12</TD><TD>00424420+4116009</TD><TD>10.065</TD><TD>null</TD><TD>9.374</TD><TD>null</TD><TD>11.504</TD><TD>0.052</TD><TD>UUA</TD><TD>002</TD><TD>002</TD><TD>00c</TD><TD>2</TD><TD>0</TD><TD>7.676590</TD><TD>190.151</TD><TD>-</TD><TD>-</TD><TD>-</TD><TD>9</TD></TR>
<TR><TD>10.685270</TD><TD>41.267124</TD><TD>00h42m44.46s</TD><TD>41d16m01.65s</TD><TD>0.13</TD><TD>0.12</TD><TD>00424446+4116016</TD><TD>12.070</TD><TD>0.035</TD><TD>9.301</TD><TD>null</TD><TD>9.057</TD><TD>null</TD><TD>EUU</TD><TD>206</TD><TD>200</TD><TD>c00</TD><TD>2</TD><TD>0</TD><TD>7.079993</TD><TD>166.968</TD><TD>-</TD><TD>-</TD><TD>-</TD><TD>10</TD></TR>
<TR><TD>10.682713</TD><TD>41.267056</TD><TD>00h42m43.85s</TD><TD>41d16m01.40s</TD><TD>0.13</TD><TD>0.12</TD><TD>00424385+4116014</TD><TD>10.176</TD><TD>null</TD><TD>11.876</TD><TD>0.050</TD><TD>9.252</TD><TD>null</TD><TD>UEU</TD><TD>020</TD><TD>010</TD><TD>0c0</TD><TD>2</TD><TD>0</TD><TD>8.907431</TD><TD>216.693</TD><TD>-</TD><TD>-</TD><TD>-</TD><TD>11</TD></TR>
<TR><TD>10.686846</TD><TD>41.270714</TD><TD>00h42m44.84s</TD><TD>41d16m14.57s</TD><TD>0.13</TD><TD>0.11</TD><TD>00424484+4116145</TD><TD>12.872</TD><TD>0.061</TD><TD>9.433</TD><TD>null</TD><TD>9.178</TD><TD>null</TD><TD>AUU</TD><TD>200</TD><TD>200</TD><TD>c00</TD><TD>2</TD><TD>0</TD><TD>8.406324</TD><TD>44.200</TD><TD>-</TD><TD>-</TD><TD>-</TD><TD>12</TD></TR>
<TR><TD>10.686015</TD><TD>41.269630</TD><TD>00h42m44.64s</TD><TD>41d16m10.67s</TD><TD>0.13</TD><TD>0.12</TD><TD>00424464+4116106</TD><TD>9.399</TD><TD>null</TD><TD>9.985</TD><TD>0.070</TD><TD>8.429</TD><TD>null</TD><TD>UEU</TD><TD>020</TD><TD>020</TD><TD>0c0</TD><TD>2</TD><TD>0</TD><TD>4.190485</TD><TD>59.544</TD><TD>-</TD><TD>-</TD><TD>-</TD><TD>13</TD></TR>
<TR><TD>10.683469</TD><TD>41.268585</TD><TD>00h42m44.03s</TD><TD>41d16m06.91s</TD><TD>0.13</TD><TD>0.12</TD><TD>00424403+4116069</TD><TD>9.321</TD><TD>null</TD><TD>8.614</TD><TD>null</TD><TD>10.601</TD><TD>0.025</TD><TD>UUE</TD><TD>002</TD><TD>001</TD><TD>00c</TD><TD>2</TD><TD>0</TD><TD>3.663337</TD><TD>243.440</TD><TD>-</TD><TD>-</TD><TD>-</TD><TD>14</TD></TR>
<TR><TD>10.683944</TD><TD>41.266682</TD><TD>00h42m44.15s</TD><TD>41d16m00.06s</TD><TD>0.13</TD><TD>0.12</TD><TD>00424414+4116000</TD><TD>12.565</TD><TD>0.055</TD><TD>9.510</TD><TD>null</TD><TD>9.274</TD><TD>null</TD><TD>AUU</TD><TD>206</TD><TD>200</TD><TD>c00</TD><TD>2</TD><TD>0</TD><TD>8.719308</TD><TD>193.203</TD><TD>-</TD><TD>-</TD><TD>-</TD><TD>15</TD></TR>
<TR><TD>10.685837</TD><TD>41.270599</TD><TD>00h42m44.60s</TD><TD>41d16m14.16s</TD><TD>0.13</TD><TD>0.12</TD><TD>00424460+4116141</TD><TD>9.880</TD><TD>null</TD><TD>12.051</TD><TD>0.068</TD><TD>8.934</TD><TD>null</TD><TD>UAU</TD><TD>020</TD><TD>020</TD><TD>0c0</TD><TD>2</TD><TD>0</TD><TD>6.426487</TD><TD>29.152</TD><TD>-</TD><TD>-</TD><TD>-</TD><TD>16</TD></TR>
<TR><TD>10.683465</TD><TD>41.269676</TD><TD>00h42m44.03s</TD><TD>41d16m10.83s</TD><TD>0.13</TD><TD>0.11</TD><TD>00424403+4116108</TD><TD>11.507</TD><TD>0.056</TD><TD>8.744</TD><TD>null</TD><TD>8.489</TD><TD>null</TD><TD>EUU</TD><TD>200</TD><TD>100</TD><TD>c00</TD><TD>2</TD><TD>0</TD><TD>4.006223</TD><TD>304.855</TD><TD>-</TD><TD>-</TD><TD>-</TD><TD>17</TD></TR>
</TABLEDATA>
</DATA>
</TABLE>
</RESOURCE>
</VOTABLE>
